[
  {
    "id": 1,
    "name": "Laptop",
    "price": 1200.50,
    "stock": 25,
    "category": {
      "id": 101,
      "name": "Electronics"
    }
  },
  {
    "id": 2,
    "name": "Headphones",
    "price": 50.00,
    "stock": 100,
    "category": {
      "id": 102,
      "name": "Accessories"
    }
  }
]
